{"artifact_revision":"v151","case_id":"http-loopback-unauthorized","code":"unauthorized","exit":4,"phase":"transport","stderr_sha256":"ef01c20bd0456cff29fea65c4824a00456a67908f14a7c16cd89ea9ebd4ae7c6","stdout_sha256":"e3b0c44298fc1c149afbf4c8996fb92427ae41e4649b934ca495991b7852b855","wire_frames":0}