{"artifact_revision":"v151","case_id":"http-loopback-default-missing","code":"default_missing","exit":1,"phase":"semantic","stderr_sha256":"d8db4e39897b6818588ac679508ff0a8b512433bbfd319e609c47ef2b53ddb20","stdout_sha256":"e3b0c44298fc1c149afbf4c8996fb92427ae41e4649b934ca495991b7852b855","wire_frames":2}