{"artifact_revision":"v151","case_id":"identifier-required-session-show","code":"identifier_required","exit":2,"phase":"parser","stderr_sha256":"3cab8d4c332b1013588b49c9968dbf04cae33140acc1468995523a743ae2f120","stdout_sha256":"e3b0c44298fc1c149afbf4c8996fb92427ae41e4649b934ca495991b7852b855","wire_frames":0}